{
  "$schema": "https://json-schema.org/draft/2020-12/schema",
  "$id": ".ci/device-evidence.schema.json",
  "title": "Device evidence record",
  "description": "Strict schema for one device evidence record (evidence.json inside an uploaded artifact). The record is a MEASURED SUBJECT, never an authorization source: every identity in it must match the protected policy in the default-branch copy of .ci/cutover-gates.json. The attestation's Sigstore bundle subject digest binds sha256 of this file externally; the record deliberately carries no digest of itself. Unknown or missing fields are rejected.",
  "type": "object",
  "additionalProperties": false,
  "required": [
    "schemaVersion",
    "device",
    "collector",
    "candidate",
    "supportSnapshot",
    "attestation",
    "measurements",
    "collectedAt"
  ],
  "properties": {
    "$schema": { "const": "./device-evidence.schema.json" },
    "schemaVersion": { "const": 1 },
    "device": {
      "type": "object",
      "additionalProperties": false,
      "required": ["id", "os", "arch", "runnerClass", "runnerLabels"],
      "properties": {
        "id": {
          "type": "string",
          "pattern": "^[a-z0-9][a-z0-9.-]*$",
          "description": "Must exactly match an active entry in the protected device allowlist."
        },
        "os": { "enum": ["fedora", "windows", "macos"] },
        "arch": { "enum": ["x64", "arm64"] },
        "runnerClass": { "enum": ["github-hosted", "self-hosted"] },
        "runnerLabels": {
          "type": "array",
          "minItems": 1,
          "uniqueItems": true,
          "items": {
            "type": "string",
            "pattern": "^[a-z0-9][a-z0-9.-]*$"
          },
          "description": "Must exactly equal the allowlist entry's labels (order-insensitive)."
        }
      }
    },
    "collector": {
      "type": "object",
      "additionalProperties": false,
      "required": ["path", "sha256"],
      "properties": {
        "path": {
          "type": "string",
          "pattern": "^\\.ci/collect-device-evidence\\.(sh|ps1)$"
        },
        "sha256": {
          "$ref": "#/$defs/digest",
          "description": "sha256 of the collector file AS PINNED ON THE DEFAULT BRANCH; must equal policy.trustedCollectors[path]."
        }
      }
    },
    "candidate": {
      "type": "object",
      "additionalProperties": false,
      "required": ["commit"],
      "properties": {
        "commit": {
          "$ref": "#/$defs/gitSha",
          "description": "Candidate checkout commit being measured. Stale or mismatched commits are rejected."
        }
      }
    },
    "supportSnapshot": {
      "type": "object",
      "additionalProperties": false,
      "required": ["path", "sha256"],
      "properties": {
        "path": { "const": ".ci/support-matrix.json" },
        "sha256": {
          "$ref": "#/$defs/digest",
          "description": "sha256 of the canonical JSON (sorted keys, no whitespace) of the support matrix snapshot the measurement ran against."
        }
      }
    },
    "attestation": {
      "type": "object",
      "additionalProperties": false,
      "required": ["kind", "bundlePath", "issuer", "repository", "workflowRef", "workflowSha", "environment"],
      "properties": {
        "kind": { "const": "github-artifact-attestation" },
        "bundlePath": {
          "type": "string",
          "pattern": "^(?!.*\\.\\.)[a-z0-9._/-]+$",
          "description": "Sigstore bundle path relative to the evidence file; cross-checked when present."
        },
        "issuer": { "const": "https://token.actions.githubusercontent.com" },
        "repository": {
          "type": "string",
          "pattern": "^[a-z0-9-]+/[a-z0-9.-]+$"
        },
        "workflowRef": {
          "type": "string",
          "pattern": "^[a-z0-9-]+/[a-z0-9.-]+/\\.github/workflows/[a-z0-9._-]+\\.yml@refs/heads/[a-z0-9][a-z0-9/_-]*$",
          "description": "Signer workflow pinned to the default branch ref."
        },
        "workflowSha": {
          "$ref": "#/$defs/gitSha",
          "description": "Git blob SHA of the signer workflow on the default branch."
        },
        "environment": {
          "type": "string",
          "minLength": 1,
          "description": "Protected environment; must equal policy.protectedEnvironment."
        }
      }
    },
    "measurements": {
      "type": "object",
      "additionalProperties": false,
      "required": ["runtimeArch", "checks"],
      "properties": {
        "runtimeArch": {
          "type": "string",
          "pattern": "^(x86_64|aarch64|amd64|AMD64|arm64|ARM64)$",
          "description": "Observed uname -m / PROCESSOR_ARCHITECTURE; must normalize to device.arch."
        },
        "checks": {
          "type": "array",
          "minItems": 1,
          "items": {
            "type": "object",
            "additionalProperties": false,
            "required": ["name", "status", "detail"],
            "properties": {
              "name": {
                "type": "string",
                "pattern": "^[a-z0-9][a-z0-9-]*$",
                "description": "Claim identifier from the gate policy's mandatory legs."
              },
              "status": { "enum": ["pass", "fail"] },
              "detail": {
                "type": "string",
                "minLength": 1,
                "maxLength": 500,
                "description": "Redacted human context; secret-shaped values are rejected."
              }
            }
          }
        }
      }
    },
    "collectedAt": {
      "type": "string",
      "pattern": "^\\d{4}-\\d{2}-\\d{2}T\\d{2}:\\d{2}:\\d{2}(\\.\\d+)?Z$"
    }
  },
  "$defs": {
    "digest": {
      "type": "string",
      "pattern": "^[0-9a-f]{64}$"
    },
    "gitSha": {
      "type": "string",
      "pattern": "^[0-9a-f]{40}$"
    }
  }
}
