{
  "$schema": "./device-evidence.schema.json",
  "schemaVersion": 1,
  "device": {
    "id": "macos-arm64-01",
    "os": "macos",
    "arch": "arm64",
    "runnerClass": "self-hosted",
    "runnerLabels": [
      "self-hosted",
      "macos",
      "arm64",
      "macos-arm64-01"
    ]
  },
  "collector": {
    "path": ".ci/collect-device-evidence.sh",
    "sha256": "1111111111111111111111111111111111111111111111111111111111111111"
  },
  "candidate": {
    "commit": "0123456789abcdef0123456789abcdef01234567"
  },
  "supportSnapshot": {
    "path": ".ci/support-matrix.json",
    "sha256": "b2ab3e5071c15188a2ed2c7692b05de554f88525113696dca4fa8d16eadf33c9"
  },
  "attestation": {
    "kind": "github-artifact-attestation",
    "bundlePath": "attestation.sigstore.json",
    "issuer": "https://token.actions.githubusercontent.com",
    "repository": "hyperlapse122/dotfiles",
    "workflowRef": "hyperlapse122/dotfiles/.github/workflows/device-smoke.yml@refs/heads/main",
    "workflowSha": "aaaaaaaaaaaaaaaaaaaaaaaaaaaaaaaaaaaaaaaa",
    "environment": "device-evidence"
  },
  "measurements": {
    "runtimeArch": "arm64",
    "checks": [
      {
        "name": "inline-image-renders-in-tmux",
        "status": "pass",
        "detail": "measured"
      },
      {
        "name": "inline-image-survives-scroll",
        "status": "pass",
        "detail": "measured"
      },
      {
        "name": "inline-image-survives-redraw",
        "status": "pass",
        "detail": "measured"
      },
      {
        "name": "inline-image-survives-resize",
        "status": "pass",
        "detail": "measured"
      },
      {
        "name": "inline-image-survives-split",
        "status": "pass",
        "detail": "measured"
      }
    ]
  },
  "collectedAt": "2026-08-04T03:02:00Z"
}
